address1,city,state,zip,country,phone,website,industry,industryKey,industryDisp,sector,sectorKey,sectorDisp,longBusinessSummary,fullTimeEmployees,companyOfficers,auditRisk,boardRisk,compensationRisk,shareHolderRightsRisk,overallRisk,governanceEpochDate,compensationAsOfEpochDate,irWebsite,maxAge,priceHint,previousClose,open,dayLow,dayHigh,regularMarketPreviousClose,regularMarketOpen,regularMarketDayLow,regularMarketDayHigh,dividendRate,dividendYield,exDividendDate,payoutRatio,fiveYearAvgDividendYield,beta,trailingPE,forwardPE,volume,regularMarketVolume,averageVolume,averageVolume10days,averageDailyVolume10Day,bid,ask,bidSize,askSize,marketCap,fiftyTwoWeekLow,fiftyTwoWeekHigh,priceToSalesTrailing12Months,fiftyDayAverage,twoHundredDayAverage,trailingAnnualDividendRate,trailingAnnualDividendYield,currency,enterpriseValue,profitMargins,floatShares,sharesOutstanding,sharesShort,sharesShortPriorMonth,sharesShortPreviousMonthDate,dateShortInterest,sharesPercentSharesOut,heldPercentInsiders,heldPercentInstitutions,shortRatio,shortPercentOfFloat,impliedSharesOutstanding,bookValue,priceToBook,lastFiscalYearEnd,nextFiscalYearEnd,mostRecentQuarter,earningsQuarterlyGrowth,netIncomeToCommon,trailingEps,forwardEps,pegRatio,lastSplitFactor,lastSplitDate,enterpriseToRevenue,enterpriseToEbitda,52WeekChange,SandP52WeekChange,lastDividendValue,lastDividendDate,exchange,quoteType,symbol,underlyingSymbol,shortName,longName,firstTradeDateEpochUtc,timeZoneFullName,timeZoneShortName,uuid,messageBoardId,gmtOffSetMilliseconds,currentPrice,targetHighPrice,targetLowPrice,targetMeanPrice,targetMedianPrice,recommendationMean,recommendationKey,numberOfAnalystOpinions,totalCash,totalCashPerShare,ebitda,totalDebt,quickRatio,currentRatio,totalRevenue,debtToEquity,revenuePerShare,returnOnAssets,returnOnEquity,freeCashflow,operatingCashflow,earningsGrowth,revenueGrowth,grossMargins,ebitdaMargins,operatingMargins,financialCurrency,trailingPegRatio
2788 San Tomas Expressway,Santa Clara,CA,95051,United States,408 486 2000,https://www.nvidia.com,Semiconductors,semiconductors,Semiconductors,Technology,technology,Technology,"NVIDIA Corporation provides graphics and compute and networking solutions in the United States, Taiwan, China, Hong Kong, and internationally. The Graphics segment offers GeForce GPUs for gaming and PCs, the GeForce NOW game streaming service and related infrastructure, and solutions for gaming platforms; Quadro/NVIDIA RTX GPUs for enterprise workstation graphics; virtual GPU or vGPU software for cloud-based visual and virtual computing; automotive platforms for infotainment systems; and Omniverse software for building and operating metaverse and 3D internet applications. The Compute & Networking segment comprises Data Center computing platforms and end-to-end networking platforms, including Quantum for InfiniBand and Spectrum for Ethernet; NVIDIA DRIVE automated-driving platform and automotive development agreements; Jetson robotics and other embedded platforms; NVIDIA AI Enterprise and other software; and DGX Cloud software and services. The company's products are used in gaming, professional visualization, data center, and automotive markets. It sells its products to original equipment manufacturers, original device manufacturers, system integrators and distributors, independent software vendors, cloud service providers, consumer internet companies, add-in board manufacturers, distributors, automotive manufacturers and tier-1 automotive suppliers, and other ecosystem participants. NVIDIA Corporation was incorporated in 1993 and is headquartered in Santa Clara, California.",29600,"[{""maxAge"": 1, ""name"": ""Mr. Jen-Hsun  Huang"", ""age"": 60, ""title"": ""Co-Founder, CEO, President & Director"", ""yearBorn"": 1963, ""fiscalYear"": 2024, ""totalPay"": 7491487, ""exercisedValue"": 217327152, ""unexercisedValue"": 0}, {""maxAge"": 1, ""name"": ""Ms. Colette M. Kress"", ""age"": 56, ""title"": ""Executive VP & CFO"", ""yearBorn"": 1967, ""fiscalYear"": 2024, ""totalPay"": 1510765, ""exercisedValue"": 0, ""unexercisedValue"": 0}, {""maxAge"": 1, ""name"": ""Ms. Debora  Shoquist"", ""age"": 68, ""title"": ""Executive Vice President of Operations"", ""yearBorn"": 1955, ""fiscalYear"": 2024, ""totalPay"": 1371266, ""exercisedValue"": 0, ""unexercisedValue"": 0}, {""maxAge"": 1, ""name"": ""Mr. Timothy S. Teter"", ""age"": 56, ""title"": ""Executive VP, General Counsel & Secretary"", ""yearBorn"": 1967, ""fiscalYear"": 2024, ""totalPay"": 1360939, ""exercisedValue"": 0, ""unexercisedValue"": 0}, {""maxAge"": 1, ""name"": ""Mr. Ajay K. Puri"", ""age"": 68, ""title"": ""Executive Vice President of Worldwide Field Operations"", ""yearBorn"": 1955, ""fiscalYear"": 2024, ""totalPay"": 2295097, ""exercisedValue"": 0, ""unexercisedValue"": 0}, {""maxAge"": 1, ""name"": ""Mr. Chris A. Malachowsky"", ""title"": ""Co-Founder"", ""fiscalYear"": 2024, ""totalPay"": 320000, ""exercisedValue"": 0, ""unexercisedValue"": 0}, {""maxAge"": 1, ""name"": ""Mr. Donald F. Robertson Jr."", ""age"": 54, ""title"": ""VP & Chief Accounting Officer"", ""yearBorn"": 1969, ""fiscalYear"": 2024, ""exercisedValue"": 0, ""unexercisedValue"": 0}, {""maxAge"": 1, ""name"": ""Prof. William J. Dally Ph.D."", ""age"": 62, ""title"": ""Chief Scientist & Senior VP of Research"", ""yearBorn"": 1961, ""fiscalYear"": 2024, ""exercisedValue"": 0, ""unexercisedValue"": 0}, {""maxAge"": 1, ""name"": ""Ms. Simona  Jankowski C.F.A., J.D."", ""title"": ""Vice President of Investor Relations"", ""fiscalYear"": 2024, ""exercisedValue"": 0, ""unexercisedValue"": 0}, {""maxAge"": 1, ""name"": ""Mr. Robert  Sherbin"", ""age"": 64, ""title"": ""Vice President of Corporate Communications"", ""yearBorn"": 1959, ""fiscalYear"": 2024, ""exercisedValue"": 0, ""unexercisedValue"": 0}]",7,10,1,6,7,1717200000,1735603200,http://phx.corporate-ir.net/phoenix.zhtml?c=116466&p=irol-IRHome,86400,2,1105.0,1125.13,1069.4,1127.17,1105.0,1125.13,1069.4,1127.17,0.4,0.0004,1718064000.0,0.0094,0.12,1.749,64.09064,33.36225,61326250,61326250,49792241,51269680,51269680,1094.49,1096.66,100,800,2695850622976,373.56,1158.19,33.793602,911.2446,639.34814,0.16,0.00014479637,USD,2678717415424,0.53398,2361698120,2459830016,27890572,29075362,1713139200,1715731200,0.0113,0.043169998,0.67523,0.64,0.0117999995,2554579968,19.96,54.907314,1706400000,1738022400,1714262400,6.284,42597998592,17.1,32.85,1.03,4:1,1626739200.0,33.579,54.363,1.7988307,0.23485482,0.04,1709596800.0,NMS,EQUITY,NVDA,NVDA,NVIDIA Corporation,NVIDIA Corporation,917015400,America/New_York,EDT,7f5f6a07-b148-30f4-98a2-2caa3df2aed0,finmb_32307,-14400000,1095.95,1289.4,440.61,1050.13,1105.2,1.8,buy,47,31438000128,12.769,49274998784,10990999552,2.877,3.529,79773999104,22.366,32.336,0.49103,1.15658,29269749760,40524001280,6.293,2.621,0.75286,0.61768,0.64925003,USD,1.3727
1 Tesla Road,Austin,TX,78725,United States,512 516 8177,https://www.tesla.com,Auto Manufacturers,auto-manufacturers,Auto Manufacturers,Consumer Cyclical,consumer-cyclical,Consumer Cyclical,"Tesla, Inc. designs, develops, manufactures, leases, and sells electric vehicles, and energy generation and storage systems in the United States, China, and internationally. The company operates in two segments, Automotive, and Energy Generation and Storage. The Automotive segment offers electric vehicles, as well as sells automotive regulatory credits; and non-warranty after-sales vehicle, used vehicles, body shop and parts, supercharging, retail merchandise, and vehicle insurance services. This segment also provides sedans and sport utility vehicles through direct and used vehicle sales, a network of Tesla Superchargers, and in-app upgrades; purchase financing and leasing services; services for electric vehicles through its company-owned service locations and Tesla mobile service technicians; and vehicle limited warranties and extended service plans. The Energy Generation and Storage segment engages in the design, manufacture, installation, sale, and leasing of solar energy generation and energy storage products, and related services to residential, commercial, and industrial customers and utilities through its website, stores, and galleries, as well as through a network of channel partners; and provision of service and repairs to its energy product customers, including under warranty, as well as various financing options to its solar customers. The company was formerly known as Tesla Motors, Inc. and changed its name to Tesla, Inc. in February 2017. Tesla, Inc. was incorporated in 2003 and is headquartered in Austin, Texas.",140473,"[{""maxAge"": 1, ""name"": ""Mr. Elon R. Musk"", ""age"": 51, ""title"": ""Technoking of Tesla, CEO & Director"", ""yearBorn"": 1972, ""fiscalYear"": 2023, ""exercisedValue"": 1861335, ""unexercisedValue"": 68433694720}, {""maxAge"": 1, ""name"": ""Mr. Vaibhav  Taneja"", ""age"": 45, ""title"": ""Chief Financial Officer"", ""yearBorn"": 1978, ""fiscalYear"": 2023, ""totalPay"": 278000, ""exercisedValue"": 8517957, ""unexercisedValue"": 202075632}, {""maxAge"": 1, ""name"": ""Mr. Xiaotong  Zhu"", ""age"": 43, ""title"": ""Senior Vice President of Automotive"", ""yearBorn"": 1980, ""fiscalYear"": 2023, ""totalPay"": 926877, ""exercisedValue"": 0, ""unexercisedValue"": 344144320}, {""maxAge"": 1, ""name"": ""Mr. Martin  Viecha"", ""title"": ""Vice President of Investor Relations"", ""fiscalYear"": 2023, ""exercisedValue"": 0, ""unexercisedValue"": 0}, {""maxAge"": 1, ""name"": ""Brian  Scelfo"", ""title"": ""Senior Director of Corporate Development"", ""fiscalYear"": 2023, ""exercisedValue"": 0, ""unexercisedValue"": 0}, {""maxAge"": 1, ""name"": ""Mr. Franz  von Holzhausen"", ""title"": ""Chief Designer"", ""fiscalYear"": 2023, ""exercisedValue"": 0, ""unexercisedValue"": 0}, {""maxAge"": 1, ""name"": ""Mr. John  Walker"", ""age"": 60, ""title"": ""Vice President of Sales - North America"", ""yearBorn"": 1963, ""fiscalYear"": 2023, ""totalPay"": 121550, ""exercisedValue"": 0, ""unexercisedValue"": 0}, {""maxAge"": 1, ""name"": ""Mr. Peter  Bannon"", ""title"": ""Chip Architect"", ""fiscalYear"": 2023, ""exercisedValue"": 0, ""unexercisedValue"": 0}, {""maxAge"": 1, ""name"": ""Mr. Turner  Caldwell"", ""title"": ""Engineering Manager"", ""fiscalYear"": 2023, ""exercisedValue"": 0, ""unexercisedValue"": 0}, {""maxAge"": 1, ""name"": ""Mr. Rodney D. Westmoreland Jr."", ""title"": ""Director of Construction Management"", ""fiscalYear"": 2023, ""exercisedValue"": 0, ""unexercisedValue"": 0}]",7,9,10,9,10,1717200000,1703980800,,86400,2,178.79,178.42,173.8201,180.32,178.79,178.42,173.8201,180.32,,,,,,2.408,45.433674,58.58553,67314602,67314602,94657485,73972190,73972190,177.95,178.44,300,400,567996514304,138.8,299.29,5.9950023,171.9572,212.0957,,,USD,551782055936,0.14368,2772400120,3189199872,104790820,106654831,1713139200,1715731200,0.032899998,0.12987,0.45941,1.03,0.0377,3189199872,20.188,8.822073,1703980800,1735603200,1711843200,-0.551,13651999744,3.92,3.04,5.42,3:1,1661385600.0,5.824,44.988,-0.18165523,0.23485482,,,NMS,EQUITY,TSLA,TSLA,"Tesla, Inc.","Tesla, Inc.",1277818200,America/New_York,EDT,ec367bc4-f92c-397c-ac81-bf7b43cffaf7,finmb_27444752,-14400000,178.1,294.72,21.05,164.83,163.48,2.8,hold,40,26862999552,8.423,12264999936,9911000064,1.05,1.716,94745001984,15.206,29.803,0.04717,0.23736,-633124992,10984999936,-0.534,-0.087,0.17778999,0.12945,0.054970004,USD,3.1645
One Microsoft Way,Redmond,WA,98052-6399,United States,425 882 8080,https://www.microsoft.com,Software - Infrastructure,software-infrastructure,Software - Infrastructure,Technology,technology,Technology,"Microsoft Corporation develops and supports software, services, devices and solutions worldwide. The Productivity and Business Processes segment offers office, exchange, SharePoint, Microsoft Teams, office 365 Security and Compliance, Microsoft viva, and Microsoft 365 copilot; and office consumer services, such as Microsoft 365 consumer subscriptions, Office licensed on-premises, and other office services. This segment also provides LinkedIn; and dynamics business solutions, including Dynamics 365, a set of intelligent, cloud-based applications across ERP, CRM, power apps, and power automate; and on-premises ERP and CRM applications. The Intelligent Cloud segment offers server products and cloud services, such as azure and other cloud services; SQL and windows server, visual studio, system center, and related client access licenses, as well as nuance and GitHub; and enterprise services including enterprise support services, industry solutions, and nuance professional services. The More Personal Computing segment offers Windows, including windows OEM licensing and other non-volume licensing of the Windows operating system; Windows commercial comprising volume licensing of the Windows operating system, windows cloud services, and other Windows commercial offerings; patent licensing; and windows Internet of Things; and devices, such as surface, HoloLens, and PC accessories. Additionally, this segment provides gaming, which includes Xbox hardware and content, and first- and third-party content; Xbox game pass and other subscriptions, cloud gaming, advertising, third-party disc royalties, and other cloud services; and search and news advertising, which includes Bing, Microsoft News and Edge, and third-party affiliates. The company sells its products through OEMs, distributors, and resellers; and directly through digital marketplaces, online, and retail stores. The company was founded in 1975 and is headquartered in Redmond, Washington.",221000,"[{""maxAge"": 1, ""name"": ""Mr. Satya  Nadella"", ""age"": 56, ""title"": ""Chairman & CEO"", ""yearBorn"": 1967, ""fiscalYear"": 2023, ""totalPay"": 9276400, ""exercisedValue"": 0, ""unexercisedValue"": 0}, {""maxAge"": 1, ""name"": ""Mr. Bradford L. Smith LCA"", ""age"": 64, ""title"": ""President & Vice Chairman"", ""yearBorn"": 1959, ""fiscalYear"": 2023, ""totalPay"": 3591277, ""exercisedValue"": 0, ""unexercisedValue"": 0}, {""maxAge"": 1, ""name"": ""Ms. Amy E. Hood"", ""age"": 51, ""title"": ""Executive VP & CFO"", ""yearBorn"": 1972, ""fiscalYear"": 2023, ""totalPay"": 3452196, ""exercisedValue"": 0, ""unexercisedValue"": 0}, {""maxAge"": 1, ""name"": ""Mr. Judson B. Althoff"", ""age"": 49, ""title"": ""Executive VP & Chief Commercial Officer"", ""yearBorn"": 1974, ""fiscalYear"": 2023, ""totalPay"": 3355797, ""exercisedValue"": 0, ""unexercisedValue"": 0}, {""maxAge"": 1, ""name"": ""Mr. Christopher David Young"", ""age"": 51, ""title"": ""Executive Vice President of Business Development, Strategy & Ventures"", ""yearBorn"": 1972, ""fiscalYear"": 2023, ""totalPay"": 2460507, ""exercisedValue"": 0, ""unexercisedValue"": 0}, {""maxAge"": 1, ""name"": ""Ms. Alice L. Jolla"", ""age"": 56, ""title"": ""Corporate VP & Chief Accounting Officer"", ""yearBorn"": 1967, ""fiscalYear"": 2023, ""exercisedValue"": 0, ""unexercisedValue"": 0}, {""maxAge"": 1, ""name"": ""Mr. James Kevin Scott"", ""age"": 51, ""title"": ""Executive VP of AI & CTO"", ""yearBorn"": 1972, ""fiscalYear"": 2023, ""exercisedValue"": 0, ""unexercisedValue"": 0}, {""maxAge"": 1, ""name"": ""Brett  Iversen"", ""title"": ""Vice President of Investor Relations"", ""fiscalYear"": 2023, ""exercisedValue"": 0, ""unexercisedValue"": 0}, {""maxAge"": 1, ""name"": ""Mr. Hossein  Nowbar"", ""title"": ""Chief Legal Officer"", ""fiscalYear"": 2023, ""exercisedValue"": 0, ""unexercisedValue"": 0}, {""maxAge"": 1, ""name"": ""Mr. Frank X. Shaw"", ""title"": ""Chief Communications Officer"", ""fiscalYear"": 2023, ""exercisedValue"": 0, ""unexercisedValue"": 0}]",3,4,2,2,1,1717200000,1703980800,http://www.microsoft.com/investor/default.aspx,86400,2,414.67,416.41,404.52,416.63,414.67,416.41,404.52,416.63,3.0,0.0072000003,1715731200.0,0.24780001,0.93,0.893,36.014297,34.01023,47995250,47995250,20049169,20783390,20783390,413.56,429.93,200,100,3088905142272,309.45,433.6,13.0562725,416.448,378.9645,2.93,0.0070658596,USD,3111588986880,0.36426997,7421528951,7432309760,43764126,56321541,1713139200,1715731200,0.0058999998,0.00054000004,0.73743,2.18,0.0058999998,7432309760,34.058,12.202861,1688083200,1719705600,1711843200,0.199,86181003264,11.54,12.22,2.56,2:1,1045526400.0,13.152,24.857,0.2357266,0.23485482,0.75,1715731200.0,NMS,EQUITY,MSFT,MSFT,Microsoft Corporation,Microsoft Corporation,511108200,America/New_York,EDT,b004b3ec-de24-385e-b2c1-923f10d3fb62,finmb_21835,-14400000,415.605,552.6,401.56,445.15,439.62,1.7,buy,47,80013000704,10.766,125182001152,106228998144,1.132,1.242,236583993344,41.963,31.834,0.15295,0.38487998,61497999360,110122999808,0.2,0.17,0.69894,0.52911997,0.44588003,USD,2.0468
410 Terry Avenue North,Seattle,WA,98109-5210,United States,206 266 1000,https://www.aboutamazon.com,Internet Retail,internet-retail,Internet Retail,Consumer Cyclical,consumer-cyclical,Consumer Cyclical,"Amazon.com, Inc. engages in the retail sale of consumer products, advertising, and subscriptions service through online and physical stores in North America and internationally. The company operates through three segments: North America, International, and Amazon Web Services (AWS). It also manufactures and sells electronic devices, including Kindle, Fire tablets, Fire TVs, Echo, Ring, Blink, and eero; and develops and produces media content. In addition, the company offers programs that enable sellers to sell their products in its stores; and programs that allow authors, independent publishers, musicians, filmmakers, Twitch streamers, skill and app developers, and others to publish and sell content. Further, it provides compute, storage, database, analytics, machine learning, and other services, as well as advertising services through programs, such as sponsored ads, display, and video advertising. Additionally, the company offers Amazon Prime, a membership program. The company's products offered through its stores include merchandise and content purchased for resale and products offered by third-party sellers. It serves consumers, sellers, developers, enterprises, content creators, advertisers, and employees. Amazon.com, Inc. was incorporated in 1994 and is headquartered in Seattle, Washington.",1525000,"[{""maxAge"": 1, ""name"": ""Mr. Jeffrey P. Bezos"", ""age"": 59, ""title"": ""Founder & Executive Chairman"", ""yearBorn"": 1964, ""fiscalYear"": 2023, ""totalPay"": 1681840, ""exercisedValue"": 0, ""unexercisedValue"": 0}, {""maxAge"": 1, ""name"": ""Mr. Andrew R. Jassy"", ""age"": 55, ""title"": ""President, CEO & Director"", ""yearBorn"": 1968, ""fiscalYear"": 2023, ""totalPay"": 1722764, ""exercisedValue"": 0, ""unexercisedValue"": 0}, {""maxAge"": 1, ""name"": ""Mr. Brian T. Olsavsky"", ""age"": 59, ""title"": ""Senior VP & CFO"", ""yearBorn"": 1964, ""fiscalYear"": 2023, ""totalPay"": 371600, ""exercisedValue"": 0, ""unexercisedValue"": 0}, {""maxAge"": 1, ""name"": ""Mr. David A. Zapolsky"", ""age"": 59, ""title"": ""Senior VP of Global Public Policy & General Counsel"", ""yearBorn"": 1964, ""fiscalYear"": 2023, ""totalPay"": 371600, ""exercisedValue"": 0, ""unexercisedValue"": 0}, {""maxAge"": 1, ""name"": ""Mr. Douglas J. Herrington"", ""age"": 56, ""title"": ""Chief Executive Officer of Worldwide Amazon Stores"", ""yearBorn"": 1967, ""fiscalYear"": 2023, ""totalPay"": 394231, ""exercisedValue"": 0, ""unexercisedValue"": 0}, {""maxAge"": 1, ""name"": ""Ms. Shelley L. Reynolds"", ""age"": 58, ""title"": ""VP, Worldwide Controller & Principal Accounting Officer"", ""yearBorn"": 1965, ""fiscalYear"": 2023, ""totalPay"": 163200, ""exercisedValue"": 0, ""unexercisedValue"": 0}, {""maxAge"": 1, ""name"": ""Dr. Werner  Vogels"", ""title"": ""Chief Technology Officer"", ""fiscalYear"": 2023, ""exercisedValue"": 0, ""unexercisedValue"": 0}, {""maxAge"": 1, ""name"": ""Mr. Dave  Fildes"", ""title"": ""Director of Investor Relations"", ""fiscalYear"": 2023, ""exercisedValue"": 0, ""unexercisedValue"": 0}, {""maxAge"": 1, ""name"": ""Ms. Anuradha  Aggarwal"", ""title"": ""CMO & Director of User Growth"", ""fiscalYear"": 2023, ""exercisedValue"": 0, ""unexercisedValue"": 0}, {""maxAge"": 1, ""name"": ""Ms. Beth  Galetti M.B.A."", ""title"": ""Senior Vice President of Worldwide Human Resources"", ""fiscalYear"": 2023, ""exercisedValue"": 0, ""unexercisedValue"": 0}]",5,10,10,3,9,1717200000,1703980800,http://phx.corporate-ir.net/phoenix.zhtml?c=97664&p=irol-irhome,86400,2,179.32,178.23,173.87,179.21,179.32,178.23,173.87,179.21,,,,,,1.155,49.563206,33.291508,58903939,58903939,39353225,35382680,35382680,166.0,176.59,100,1000,1836192497664,118.35,191.7,3.108292,182.2586,156.8655,,,USD,1911631380480,0.06379,9262106532,10406599680,70812929,75734073,1713139200,1715731200,0.0068,0.09165,0.6363,1.55,0.0076,10406599680,20.827,8.471936,1703980800,1735603200,1711843200,2.288,37683998720,3.56,5.3,1.5,20:1,1654473600.0,3.236,19.787,0.40814042,0.23485482,,,NMS,EQUITY,AMZN,AMZN,"Amazon.com, Inc.","Amazon.com, Inc.",863703000,America/New_York,EDT,261fd26b-0151-3813-b0d0-97e4ed4c6505,finmb_18749,-14400000,176.445,460.5,165.78,209.16,202.62,1.7,buy,53,85074001920,8.175,96609001472,160560005120,0.829,1.072,590739996672,74.107,57.133,0.059510004,0.20305,57269751808,99146997760,2.167,0.125,0.47594002,0.16354,0.106809996,USD,1.8831
One Apple Park Way,Cupertino,CA,95014,United States,408 996 1010,https://www.apple.com,Consumer Electronics,consumer-electronics,Consumer Electronics,Technology,technology,Technology,"Apple Inc. designs, manufactures, and markets smartphones, personal computers, tablets, wearables, and accessories worldwide. The company offers iPhone, a line of smartphones; Mac, a line of personal computers; iPad, a line of multi-purpose tablets; and wearables, home, and accessories comprising AirPods, Apple TV, Apple Watch, Beats products, and HomePod. It also provides AppleCare support and cloud services; and operates various platforms, including the App Store that allow customers to discover and download applications and digital content, such as books, music, video, games, and podcasts. In addition, the company offers various services, such as Apple Arcade, a game subscription service; Apple Fitness+, a personalized fitness service; Apple Music, which offers users a curated listening experience with on-demand radio stations; Apple News+, a subscription news and magazine service; Apple TV+, which offers exclusive original content; Apple Card, a co-branded credit card; and Apple Pay, a cashless payment service, as well as licenses its intellectual property. The company serves consumers, and small and mid-sized businesses; and the education, enterprise, and government markets. It distributes third-party applications for its products through the App Store. The company also sells its products through its retail and online stores, and direct sales force; and third-party cellular network carriers, wholesalers, retailers, and resellers. Apple Inc. was founded in 1976 and is headquartered in Cupertino, California.",150000,"[{""maxAge"": 1, ""name"": ""Mr. Timothy D. Cook"", ""age"": 62, ""title"": ""CEO & Director"", ""yearBorn"": 1961, ""fiscalYear"": 2023, ""totalPay"": 16239562, ""exercisedValue"": 0, ""unexercisedValue"": 0}, {""maxAge"": 1, ""name"": ""Mr. Luca  Maestri"", ""age"": 60, ""title"": ""CFO & Senior VP"", ""yearBorn"": 1963, ""fiscalYear"": 2023, ""totalPay"": 4612242, ""exercisedValue"": 0, ""unexercisedValue"": 0}, {""maxAge"": 1, ""name"": ""Mr. Jeffrey E. Williams"", ""age"": 59, ""title"": ""Chief Operating Officer"", ""yearBorn"": 1964, ""fiscalYear"": 2023, ""totalPay"": 4637585, ""exercisedValue"": 0, ""unexercisedValue"": 0}, {""maxAge"": 1, ""name"": ""Ms. Katherine L. Adams"", ""age"": 59, ""title"": ""Senior VP, General Counsel & Secretary"", ""yearBorn"": 1964, ""fiscalYear"": 2023, ""totalPay"": 4618064, ""exercisedValue"": 0, ""unexercisedValue"": 0}, {""maxAge"": 1, ""name"": ""Ms. Deirdre  O'Brien"", ""age"": 56, ""title"": ""Senior Vice President of Retail"", ""yearBorn"": 1967, ""fiscalYear"": 2023, ""totalPay"": 4613369, ""exercisedValue"": 0, ""unexercisedValue"": 0}, {""maxAge"": 1, ""name"": ""Mr. Chris  Kondo"", ""title"": ""Senior Director of Corporate Accounting"", ""fiscalYear"": 2023, ""exercisedValue"": 0, ""unexercisedValue"": 0}, {""maxAge"": 1, ""name"": ""Mr. James  Wilson"", ""title"": ""Chief Technology Officer"", ""fiscalYear"": 2023, ""exercisedValue"": 0, ""unexercisedValue"": 0}, {""maxAge"": 1, ""name"": ""Suhasini  Chandramouli"", ""title"": ""Director of Investor Relations"", ""fiscalYear"": 2023, ""exercisedValue"": 0, ""unexercisedValue"": 0}, {""maxAge"": 1, ""name"": ""Mr. Greg  Joswiak"", ""title"": ""Senior Vice President of Worldwide Marketing"", ""fiscalYear"": 2023, ""exercisedValue"": 0, ""unexercisedValue"": 0}, {""maxAge"": 1, ""name"": ""Mr. Adrian  Perica"", ""age"": 49, ""title"": ""Head of Corporate Development"", ""yearBorn"": 1974, ""fiscalYear"": 2023, ""exercisedValue"": 0, ""unexercisedValue"": 0}]",6,1,2,1,1,1717200000,1703980800,http://investor.apple.com/,86400,2,191.29,191.44,189.91,192.57,191.29,191.44,189.91,192.57,1.0,0.0052,1715299200.0,0.14930001,0.71,1.264,29.957165,28.877628,75158277,75158277,62563592,48031370,48031370,181.78,201.14,100,100,2949130747904,164.08,199.62,7.7278643,177.1718,181.23856,0.96,0.0050185584,USD,2985417244672,0.26306,15308320742,15334099968,99287450,101912593,1713139200,1715731200,0.0064999997,0.052199997,0.57662,1.53,0.0064999997,15663899648,4.837,39.761215,1696032000,1727654400,1711756800,-0.022,100389003264,6.42,6.66,3.28,4:1,1598832000.0,7.823,23.03,0.07055354,0.23485482,0.25,1715299200.0,NMS,EQUITY,AAPL,AAPL,Apple Inc.,Apple Inc.,345479400,America/New_York,EDT,8b10e4ae-9eeb-3684-921a-9ab27e4d87aa,finmb_24937,-14400000,192.325,253.28,151.04,188.42,185.52,2.1,buy,40,67150000128,4.379,129629003776,104590000128,0.875,1.037,381623009280,140.968,24.537,0.22073999,1.4725,84726874112,110563000320,0.007,-0.043,0.45586,0.33968,0.30743,USD,2.2798
